"annotation_id","annotator","created_at","id","label","lead_time","text","updated_at"
6,"1","2024-03-12T07:30:08.986996Z",2105,"[{""start"":5,""end"":12,""text"":""animals"",""labels"":[""ASPECT""]},{""start"":0,""end"":5,""text"":""cute "",""labels"":[""OPINION""]}]",137.54299999999998,"cute animals. bought annual pass, and we have visited 3x now.","2024-03-12T07:30:08.986996Z"
5,"1","2024-03-12T07:18:48.209979Z",2106,"[{""start"":10,""end"":16,""text"":""place "",""labels"":[""ASPECT""]},{""start"":0,""end"":10,""text"":""fantastic "",""labels"":[""OPINION""]},{""start"":49,""end"":57,""text"":""tickets "",""labels"":[""ASPECT""]},{""start"":77,""end"":84,""text"":""higher "",""labels"":[""OPINION""]},{""start"":97,""end"":108,""text"":""experience "",""labels"":[""ASPECT""]},{""start"":111,""end"":119,""text"":""worth it"",""labels"":[""OPINION""]},{""start"":125,""end"":133,""text"":""animals "",""labels"":[""ASPECT""]},{""start"":146,""end"":157,""text"":""well looked"",""labels"":[""OPINION""]},{""start"":168,""end"":173,""text"":""cared"",""labels"":[""OPINION""]},{""start"":287,""end"":292,""text"":""cafe "",""labels"":[""ASPECT""]},{""start"":305,""end"":312,""text"":""lovely "",""labels"":[""OPINION""]},{""start"":317,""end"":324,""text"":""amazing"",""labels"":[""OPINION""]},{""start"":325,""end"":329,""text"":""food"",""labels"":[""ASPECT""]}]",903.3910000000001,"fantastic place to go with the whole family. the tickets are slightly on the higher side but the experience is worth it. the animals appear to be well looked after and cared for. there is heaps of animals that roam freely that you can touch, pat and feed. im very impressed overall. the cafe is also very lovely with amazing food.","2024-03-12T07:18:48.209979Z"
7,"1","2024-03-12T07:43:55.311677Z",2107,"[{""start"":30,""end"":38,""text"":""weather "",""labels"":[""ASPECT""]},{""start"":42,""end"":47,""text"":""good "",""labels"":[""OPINION""]},{""start"":51,""end"":58,""text"":""walking"",""labels"":[""ASPECT""]}]",673.021,"we were up here mid feburary. weather was good for walking. and theres lots of it, so many paths and trails. was good to see so many open areas for the animals. kids enjoyed feeding the kangaroos and an attempt at an emu before nerves kicked in size difference walkways are well maintained and clean, but it is slightly hilly in some parts. spent about 2.5hrs walking around exploring everything. good for all ages.","2024-03-12T07:43:55.311677Z"
8,"1","2024-03-12T07:45:49.291947Z",2108,"[{""start"":50,""end"":55,""text"":""staff"",""labels"":[""ASPECT""]},{""start"":60,""end"":69,""text"":""gift shop"",""labels"":[""ASPECT""]},{""start"":74,""end"":83,""text"":""fantastic"",""labels"":[""OPINION""]}]",60.384,"great place any weather. lots to see and do cafe, staff and gift shop are fantastic. become a member, visit twice in a year and it has paid for itself. ive been 4 times this year already","2024-03-12T07:45:49.291947Z"
9,"1","2024-03-12T07:46:09.958686Z",2109,"",19.73,"a must visit for tourists and locals. we hadnt visited for many years and decided it was time to revisit. we bought yearly memberships so we can now visit whenever we like. well worth the money and value received with only 2 visits. the park is well laid out, paths are sealed so good for parks, wheelchairs, etc. all the animals were very relaxed and friendly. great views over adelaide by the yellow footed rock wallabies rockery. the cafe was inviting and served amazing wedges and good coffee. there is a cosy lo9king fireplace for the winter visits. the animals were quite active on a cooler summers morning.","2024-03-12T07:46:09.958686Z"
